{"source": "synthetic", "generator": {"name": "picket-synth", "version": 1, "seed": 42, "attack": "fabrication"}, "frames": [[0, 270, 8, [0, 32, 16, 16, 0, 0, 14, 78]], [3295, 284, 8, [0, 129, 64, 16, 0, 0, 28, 237]], [3455, 1285, 8, [0, 132, 66, 16, 0, 0, 5, 219]], [4514, 845, 8, [0, 16, 8, 16, 0, 0, 77, 117]], [6487, 1551, 8, [0, 10, 5, 16, 0, 0, 15, 46]], [11760, 1003, 8, [0, 110, 55, 16, 0, 0, 235, 160]], [13376, 1285, 8, [1, 133, 66, 16, 0, 0, 5, 221]], [13583, 284, 8, [1, 128, 64, 16, 0, 0, 28, 237]], [15698, 275, 8, [0, 45, 22, 16, 0, 0, 19, 102]], [23240, 284, 8, [2, 128, 64, 16, 0, 0, 28, 238]], [23387, 1285, 8, [2, 135, 67, 16, 0, 0, 5, 225]], [25315, 845, 8, [1, 14, 7, 16, 0, 0, 77, 115]], [31834, 1003, 8, [1, 111, 55, 16, 0, 0, 235, 162]], [32319, 1751, 8, [0, 87, 43, 16, 0, 0, 215, 105]], [33197, 284, 8, [3, 130, 65, 16, 0, 0, 28, 242]], [33672, 1285, 8, [3, 137, 68, 16, 0, 0, 5, 229]], [36188, 275, 8, [1, 46, 23, 16, 0, 0, 19, 105]], [37726, 1211, 8, [0, 138, 69, 16, 0, 0, 187, 154]], [38548, 1408, 8, [0, 189, 94, 16, 0, 0, 128, 171]], [43155, 284, 8, [4, 132, 66, 16, 0, 0, 28, 246]], [43843, 1285, 8, [4, 138, 69, 16, 0, 0, 5, 232]], [45337, 845, 8, [2, 12, 6, 16, 0, 0, 77, 113]], [51698, 1003, 8, [2, 110, 55, 16, 0, 0, 235, 162]], [52794, 284, 8, [5, 131, 65, 16, 0, 0, 28, 245]], [52974, 462, 8, [0, 114, 57, 16, 0, 0, 206, 137]], [53987, 1285, 8, [5, 138, 69, 16, 0, 0, 5, 233]], [56061, 275, 8, [2, 46, 23, 16, 0, 0, 19, 106]], [56671, 1551, 8, [1, 11, 5, 16, 0, 0, 15, 48]], [62931, 284, 8, [6, 129, 64, 16, 0, 0, 28, 243]], [64057, 1285, 8, [6, 136, 68, 16, 0, 0, 5, 231]], [64627, 845, 8, [3, 11, 5, 16, 0, 0, 77, 112]], [72124, 1003, 8, [3, 108, 54, 16, 0, 0, 235, 160]], [72917, 284, 8, [7, 130, 65, 16, 0, 0, 28, 246]], [74010, 1285, 8, [7, 134, 67, 16, 0, 0, 5, 229]], [75996, 275, 8, [3, 45, 22, 16, 0, 0, 19, 105]], [80483, 854, 8, [0, 11, 5, 16, 0, 0, 86, 118]], [81013, 1751, 8, [1, 87, 43, 16, 0, 0, 215, 106]], [83133, 284, 8, [8, 130, 65, 16, 0, 0, 28, 247]], [83829, 1285, 8, [8, 132, 66, 16, 0, 0, 5, 227]], [84365, 845, 8, [4, 12, 6, 16, 0, 0, 77, 115]], [87376, 1408, 8, [1, 189, 94, 16, 0, 0, 128, 172]], [92126, 1003, 8, [4, 108, 54, 16, 0, 0, 235, 161]], [93025, 284, 8, [9, 129, 64, 16, 0, 0, 28, 246]], [93829, 1285, 8, [9, 134, 67, 16, 0, 0, 5, 231]], [96033, 275, 8, [4, 44, 22, 16, 0, 0, 19, 105]], [97969, 270, 8, [1, 32, 16, 16, 0, 0, 14, 79]], [103133, 284, 8, [10, 129, 64, 16, 0, 0, 28, 247]], [103910, 1285, 8, [10, 136, 68, 16, 0, 0, 5, 235]], [103955, 845, 8, [5, 12, 6, 16, 0, 0, 77, 116]], [106944, 1551, 8, [2, 13, 6, 16, 0, 0, 15, 52]], [113165, 1003, 8, [5, 110, 55, 16, 0, 0, 235, 165]], [113182, 284, 8, [11, 130, 65, 16, 0, 0, 28, 250]], [113824, 1285, 8, [11, 138, 69, 16, 0, 0, 5, 239]], [116533, 275, 8, [5, 45, 22, 16, 0, 0, 19, 107]], [123147, 284, 8, [12, 132, 66, 16, 0, 0, 28, 254]], [123790, 1285, 8, [12, 136, 68, 16, 0, 0, 5, 237]], [124319, 845, 8, [6, 14, 7, 16, 0, 0, 77, 120]], [130942, 1751, 8, [2, 88, 44, 16, 0, 0, 215, 109]], [133357, 284, 8, [13, 133, 66, 16, 0, 0, 28, 0]], [133474, 1285, 8, [13, 134, 67, 16, 0, 0, 5, 235]], [133739, 1003, 8, [6, 110, 55, 16, 0, 0, 235, 166]], [136667, 275, 8, [6, 43, 21, 16, 0, 0, 19, 105]], [137718, 1408, 8, [2, 189, 94, 16, 0, 0, 128, 173]], [139698, 1211, 8, [1, 140, 70, 16, 0, 0, 187, 158]], [143032, 284, 8, [14, 135, 67, 16, 0, 0, 28, 4]], [143254, 1285, 8, [14, 135, 67, 16, 0, 0, 5, 237]], [144204, 845, 8, [7, 16, 8, 16, 0, 0, 77, 124]], [149793, 462, 8, [1, 112, 56, 16, 0, 0, 206, 135]], [152907, 1285, 8, [15, 135, 67, 16, 0, 0, 5, 238]], [153155, 284, 8, [15, 137, 68, 16, 0, 0, 28, 8]], [153775, 1003, 8, [7, 108, 54, 16, 0, 0, 235, 164]], [156301, 275, 8, [7, 41, 20, 16, 0, 0, 19, 103]], [156382, 1551, 8, [3, 11, 5, 16, 0, 0, 15, 50]], [163004, 1285, 8, [16, 134, 67, 16, 0, 0, 5, 238]], [163251, 284, 8, [16, 139, 69, 16, 0, 0, 28, 12]], [163970, 845, 8, [8, 15, 7, 16, 0, 0, 77, 123]], [173110, 1285, 8, [17, 133, 66, 16, 0, 0, 5, 237]], [173333, 284, 8, [17, 141, 70, 16, 0, 0, 28, 16]], [173752, 1003, 8, [8, 110, 55, 16, 0, 0, 235, 168]], [176892, 275, 8, [8, 43, 21, 16, 0, 0, 19, 107]], [180113, 854, 8, [1, 12, 6, 16, 0, 0, 86, 121]], [180593, 1751, 8, [3, 90, 45, 16, 0, 0, 215, 113]], [182723, 1285, 8, [18, 131, 65, 16, 0, 0, 5, 235]], [183490, 284, 8, [18, 142, 71, 16, 0, 0, 28, 19]], [183713, 845, 8, [9, 17, 8, 16, 0, 0, 77, 127]], [189447, 1408, 8, [3, 188, 94, 16, 0, 0, 128, 173]], [192451, 1285, 8, [19, 131, 65, 16, 0, 0, 5, 236]], [193481, 284, 8, [19, 142, 71, 16, 0, 0, 28, 20]], [193684, 1003, 8, [9, 109, 54, 16, 0, 0, 235, 167]], [196675, 275, 8, [9, 42, 21, 16, 0, 0, 19, 107]], [199645, 270, 8, [2, 33, 16, 16, 0, 0, 14, 81]], [202242, 1285, 8, [20, 129, 64, 16, 0, 0, 5, 234]], [203419, 284, 8, [20, 140, 70, 16, 0, 0, 28, 18]], [203605, 845, 8, [10, 16, 8, 16, 0, 0, 77, 127]], [206493, 1551, 8, [4, 11, 5, 16, 0, 0, 15, 51]], [212364, 1285, 8, [21, 129, 64, 16, 0, 0, 5, 235]], [213823, 284, 8, [21, 142, 71, 16, 0, 0, 28, 22]], [213856, 1003, 8, [10, 110, 55, 16, 0, 0, 235, 170]], [215926, 275, 8, [10, 40, 20, 16, 0, 0, 19, 105]], [222380, 1285, 8, [22, 130, 65, 16, 0, 0, 5, 238]], [223311, 845, 8, [11, 14, 7, 16, 0, 0, 77, 125]], [223923, 284, 8, [22, 141, 70, 16, 0, 0, 28, 21]], [231821, 1751, 8, [4, 91, 45, 16, 0, 0, 215, 115]], [232253, 1285, 8, [23, 129, 64, 16, 0, 0, 5, 237]], [233516, 1003, 8, [11, 109, 54, 16, 0, 0, 235, 169]], [233587, 284, 8, [23, 140, 70, 16, 0, 0, 28, 21]], [236671, 275, 8, [11, 42, 21, 16, 0, 0, 19, 109]], [238582, 1211, 8, [2, 138, 69, 16, 0, 0, 187, 156]], [239201, 1408, 8, [4, 187, 93, 16, 0, 0, 128, 172]], [242280, 1285, 8, [24, 130, 65, 16, 0, 0, 5, 240]], [243500, 284, 8, [24, 142, 71, 16, 0, 0, 28, 25]], [243505, 845, 8, [12, 14, 7, 16, 0, 0, 77, 126]], [250642, 462, 8, [2, 111, 55, 16, 0, 0, 206, 134]], [252191, 1285, 8, [25, 129, 64, 16, 0, 0, 5, 239]], [253083, 284, 8, [25, 141, 70, 16, 0, 0, 28, 24]], [253761, 1003, 8, [12, 109, 54, 16, 0, 0, 235, 170]], [256494, 1551, 8, [5, 13, 6, 16, 0, 0, 15, 55]], [256598, 275, 8, [12, 41, 20, 16, 0, 0, 19, 108]], [262244, 1285, 8, [26, 131, 65, 16, 0, 0, 5, 243]], [263007, 284, 8, [26, 142, 71, 16, 0, 0, 28, 27]], [263470, 845, 8, [13, 13, 6, 16, 0, 0, 77, 125]], [272002, 1285, 8, [27, 131, 65, 16, 0, 0, 5, 244]], [272587, 284, 8, [27, 141, 70, 16, 0, 0, 28, 26]], [274027, 1003, 8, [13, 111, 55, 16, 0, 0, 235, 174]], [276829, 275, 8, [13, 43, 21, 16, 0, 0, 19, 112]], [278751, 854, 8, [2, 10, 5, 16, 0, 0, 86, 119]], [282134, 1751, 8, [5, 90, 45, 16, 0, 0, 215, 115]], [282527, 1285, 8, [28, 132, 66, 16, 0, 0, 5, 247]], [282874, 284, 8, [28, 139, 69, 16, 0, 0, 28, 24]], [283298, 845, 8, [14, 14, 7, 16, 0, 0, 77, 128]], [289979, 1408, 8, [5, 187, 93, 16, 0, 0, 128, 173]], [292797, 1285, 8, [29, 133, 66, 16, 0, 0, 5, 249]], [293172, 284, 8, [29, 141, 70, 16, 0, 0, 28, 28]], [294174, 1003, 8, [14, 113, 56, 16, 0, 0, 235, 178]], [297302, 275, 8, [14, 45, 22, 16, 0, 0, 19, 116]], [302780, 1285, 8, [30, 131, 65, 16, 0, 0, 5, 247]], [303182, 284, 8, [30, 143, 71, 16, 0, 0, 28, 32]], [303203, 845, 8, [15, 14, 7, 16, 0, 0, 77, 129]], [303639, 270, 8, [3, 34, 17, 16, 0, 0, 14, 84]], [304043, 1551, 8, [6, 15, 7, 16, 0, 0, 15, 59]], [312392, 1285, 8, [31, 132, 66, 16, 0, 0, 5, 250]], [313447, 284, 8, [31, 142, 71, 16, 0, 0, 28, 32]], [314059, 1003, 8, [15, 113, 56, 16, 0, 0, 235, 179]], [317172, 275, 8, [15, 44, 22, 16, 0, 0, 19, 116]], [322649, 1285, 8, [32, 130, 65, 16, 0, 0, 5, 248]], [323081, 845, 8, [16, 14, 7, 16, 0, 0, 77, 130]], [323674, 284, 8, [32, 141, 70, 16, 0, 0, 28, 31]], [332202, 1751, 8, [6, 88, 44, 16, 0, 0, 215, 113]], [332491, 1285, 8, [33, 130, 65, 16, 0, 0, 5, 249]], [333486, 284, 8, [33, 139, 69, 16, 0, 0, 28, 29]], [333936, 1003, 8, [16, 112, 56, 16, 0, 0, 235, 179]], [336975, 275, 8, [16, 42, 21, 16, 0, 0, 19, 114]], [339603, 1408, 8, [6, 185, 92, 16, 0, 0, 128, 171]], [339937, 1211, 8, [3, 140, 70, 16, 0, 0, 187, 160]], [342458, 1285, 8, [34, 129, 64, 16, 0, 0, 5, 248]], [343573, 284, 8, [34, 139, 69, 16, 0, 0, 28, 30]], [343759, 845, 8, [17, 12, 6, 16, 0, 0, 77, 128]], [349012, 462, 8, [3, 109, 54, 16, 0, 0, 206, 132]], [352245, 1285, 8, [35, 127, 63, 16, 0, 0, 5, 246]], [352626, 1551, 8, [7, 16, 8, 16, 0, 0, 15, 62]], [353212, 284, 8, [35, 137, 68, 16, 0, 0, 28, 28]], [354310, 1003, 8, [17, 110, 55, 16, 0, 0, 235, 177]], [356743, 275, 8, [17, 40, 20, 16, 0, 0, 19, 112]], [362235, 1285, 8, [36, 129, 64, 16, 0, 0, 5, 250]], [363223, 845, 8, [18, 11, 5, 16, 0, 0, 77, 127]], [363666, 284, 8, [36, 136, 68, 16, 0, 0, 28, 28]], [372057, 1285, 8, [37, 130, 65, 16, 0, 0, 5, 253]], [373794, 284, 8, [37, 136, 68, 16, 0, 0, 28, 29]], [374176, 1003, 8, [18, 111, 55, 16, 0, 0, 235, 179]], [376845, 275, 8, [18, 40, 20, 16, 0, 0, 19, 113]], [378442, 854, 8, [3, 12, 6, 16, 0, 0, 86, 123]], [380883, 1751, 8, [7, 89, 44, 16, 0, 0, 215, 115]], [381901, 1285, 8, [38, 131, 65, 16, 0, 0, 5, 255]], [382466, 845, 8, [19, 12, 6, 16, 0, 0, 77, 130]], [383831, 284, 8, [38, 136, 68, 16, 0, 0, 28, 30]], [389469, 1408, 8, [7, 185, 92, 16, 0, 0, 128, 172]], [392005, 1285, 8, [39, 129, 64, 16, 0, 0, 5, 253]], [393379, 1003, 8, [19, 112, 56, 16, 0, 0, 235, 182]], [393816, 284, 8, [39, 137, 68, 16, 0, 0, 28, 32]], [397106, 275, 8, [19, 41, 20, 16, 0, 0, 19, 115]], [401969, 1285, 8, [40, 127, 63, 16, 0, 0, 5, 251]], [402262, 1551, 8, [8, 15, 7, 16, 0, 0, 15, 61]], [402553, 845, 8, [20, 12, 6, 16, 0, 0, 77, 131]], [403653, 284, 8, [40, 137, 68, 16, 0, 0, 28, 33]], [404467, 270, 8, [4, 34, 17, 16, 0, 0, 14, 85]], [412089, 1285, 8, [41, 125, 62, 16, 0, 0, 5, 249]], [413460, 284, 8, [41, 138, 69, 16, 0, 0, 28, 36]], [413925, 1003, 8, [20, 114, 57, 16, 0, 0, 235, 186]], [417311, 275, 8, [20, 42, 21, 16, 0, 0, 19, 118]], [422033, 1285, 8, [42, 126, 63, 16, 0, 0, 5, 252]], [422748, 845, 8, [21, 11, 5, 16, 0, 0, 77, 130]], [423735, 284, 8, [42, 137, 68, 16, 0, 0, 28, 35]], [430895, 1751, 8, [8, 89, 44, 16, 0, 0, 215, 116]], [432127, 1285, 8, [43, 127, 63, 16, 0, 0,